{
  "$schema": "https://json-schema.org/draft/2020-12/schema",
  "$id": "https://memcoder.local/schemas/design_doc.schema.json",
  "title": "MemCoder design document",
  "type": "object",
  "additionalProperties": true,
  "required": [
    "repo_id",
    "commit",
    "document_id",
    "topic",
    "difficulty",
    "generator",
    "prompt_version",
    "document"
  ],
  "properties": {
    "repo_id": {
      "type": "string",
      "description": "Repository identifier using the owner__repo convention."
    },
    "commit": {
      "type": "string",
      "description": "Source repository commit used to generate this document."
    },
    "document_id": {
      "type": "string",
      "description": "Stable ID for this design document, usually {topic_slug}_{n}."
    },
    "topic": {
      "type": "string",
      "description": "Human-readable topic title."
    },
    "topic_slug": {
      "type": "string",
      "description": "Machine-readable topic identifier."
    },
    "difficulty": {
      "type": "string",
      "enum": ["easy", "medium", "hard"]
    },
    "generator": {
      "type": "string",
      "description": "Tool or model that generated the document."
    },
    "prompt_version": {
      "type": "string",
      "description": "Prompt template version used to generate the document."
    },
    "description": {
      "type": "string",
      "minLength": 1,
      "description": "Short summary of what this document explains and what kinds of questions it can answer."
    },
    "document": {
      "type": "string",
      "minLength": 1,
      "description": "The prose document text consumed by the SHINE eval script."
    }
  },
  "allOf": [
    {
      "if": {
        "properties": {
          "prompt_version": {
            "const": "design_doc_generation_v1"
          }
        },
        "required": ["prompt_version"]
      },
      "then": {
        "required": ["description"]
      }
    }
  ]
}
