{
  "repo_id": "fogleman__Craft",
  "commit": "d6888a6e1e54340358ce25b1220f410541360b6b",
  "document_id": "persistence_database_cache_1",
  "topic": "Persistence, Database, and Cache",
  "topic_slug": "persistence_database_cache",
  "difficulty": "easy",
  "generator": "codex_subagents_v1",
  "prompt_version": "design_doc_generation_v1",
  "description": "Explains how Craft persists world edits, player state, signs, lights, auth tokens, and multiplayer cache keys through sqlite and a background write queue.",
  "document": "Craft uses sqlite persistence to keep player-made changes separate from the generated world. The README describes the default terrain as deterministic, so the database does not need to store every generated block. Instead, it stores the deltas that players or servers apply on top of generated terrain. The main block table records the chunk pair, the block position, and the block type, with empty air represented as a block value of zero. Chunks themselves keep block and light data in hash maps while the game is running, and the database is used to restore those maps when a chunk is loaded again.\n\nThe persistence layer lives mostly in `src/db.c`, with declarations in `src/db.h`. A small enable flag lets the rest of the program call database functions safely even when persistence is disabled. During startup, `db_init` opens the selected sqlite file, attaches the authentication database, creates the needed tables and indexes if they are missing, prepares reusable statements, begins a transaction, and starts the background database worker. The schema covers player state, block edits, light edits, sign text, per-chunk cache keys, and saved login identity tokens. On shutdown, the code stops the worker, commits outstanding work, finalizes prepared statements, and closes the database.\n\nChunk loading combines generation with persistence in a fixed order. In `load_chunk`, Craft first calls the terrain generator for the requested chunk, then loads saved block and light rows for that same chunk so database deltas override the default world. In `init_chunk`, sign text for the chunk is loaded into the chunk's sign list. Player position and view rotation are handled separately: the main loop asks the database for saved state after initialization, and if none exists it places the player above the terrain. Before leaving a mode, the game saves the current state so the next session can resume there.\n\nWorld edits flow through the gameplay helpers in `src/main.c`. `set_block` computes the home chunk for an edited block, writes the change into the in-memory map, marks affected chunks dirty for remeshing, stores neighbor overlap entries where chunk borders need to know about the block, and sends the update to the server or client layer. When a block is removed from its home chunk, any sign and light at that position are cleared as well. Light changes are handled similarly by `set_light` and the light toggle path. Sign text is different: adding, replacing, and deleting signs update the sign list and write through to sqlite directly rather than using the background queue.\n\nThe write queue is implemented by `Ring` in `src/ring.c`. It is a circular buffer of typed entries for block writes, light writes, cache-key writes, commits, and exit requests. The buffer starts with a fixed capacity but doubles when full, preserving queued entries in order. Public database functions for block, light, key, and commit work lock a mutex, append the corresponding entry, signal a condition variable, and return. The worker thread waits on that condition, removes one entry at a time, and performs the actual sqlite statement or transaction boundary. This keeps heavier cache writes away from the main game loop, which the README calls out as important when connecting to a server for the first time.\n\nCraft also uses sqlite as an online chunk cache. When the player requests a chunk, `request_chunk` reads that chunk's saved cache key and sends it with the request so the server can send only changes newer than the cached key. When network parsing later receives a key update from the server, it stores the new value through the same queued database path. The `/online` command switches to a database path named for the server address and port, while `/offline` chooses either a named save file or the default local save. In online mode, cached signs are cleared at database startup because the code does not implement full sign deletion caching there."
}
