{
  "repo_id": "marimo-team__marimo",
  "commit": "979fe6a82ebfbc151de8a59461de5cfafe61db78",
  "document_id": "public_interface_1",
  "topic": "Public Python Interface",
  "topic_slug": "public_interface",
  "difficulty": "easy",
  "generator": "codex_subagents_v1",
  "prompt_version": "design_doc_generation_v1",
  "description": "Explains how marimo exposes its top-level Python API, how the API docs group the interface, and when developers should use key public helpers for apps, markdown, state, outputs, and console capture.",
  "document": "The public Python interface for marimo is organized around the convention that notebook authors import the package as `mo` and access the supported API from that single namespace. The root package file, `marimo/__init__.py`, is the central declaration of this surface: it names the public exports and re-exports implementations from internal modules. That file makes the interface feel compact even though the implementation is spread across notebook app construction, runtime helpers, output formatting, UI components, stateless display plugins, SQL integration, caching, island generation, and server embedding. The source-level intent is that callers should depend on the top-level namespace rather than importing most internal modules directly.\n\nThe API reference reinforces that same shape. `docs/api/index.md` introduces the library as the way to connect interactive inputs to Python, create dynamic markdown, arrange notebook output, render media, and control execution. Rather than presenting the interface as one long symbol table, the docs divide it by tasks: markdown, inputs, layouts, plotting, media, diagrams, status, outputs, control flow, HTML handling, query parameters, command-line arguments, caching, state, apps, cells, file watching, and miscellaneous utilities. This means the public surface is broad, but it is meant to be approached through user goals in notebooks and apps.\n\nNotebook and app construction are part of the public interface. The root package exposes `App` and `Cell` for defining or running notebook structures from Python, and the app API documentation highlights app embedding and running. The app documentation also exposes app metadata through `app_meta` and `AppMeta`, so code can work with notebook-level metadata through supported marimo APIs. The root namespace also includes server and island helpers, which shows that public marimo usage covers both notebook authoring and embedding notebook behavior into other environments.\n\nMarkdown output is one of the core public workflows. The markdown API centers on `md`, which lets notebook code create interactive and dynamic markdown by interpolating Python values and marimo elements. The docs also describe `latex` as the public path for loading LaTeX macros, with an important timing constraint: because loading macros has side effects, it should be used in the same cell as the marimo import so later cells see the macros. Icons are supported both through markdown icon syntax for simple cases and through `icon` for configurable rendering such as size or color.\n\nState is public but intentionally discouraged for common interactivity. The state documentation warns that UI elements already carry their own values and that marimo's reactive execution usually lets a developer respond to interactions just by reading those values. `state` exists for advanced cases such as preserving history that cannot be derived from a widget's current value, synchronizing multiple UI elements, or introducing cycles across cells. The docs are explicit that most users should avoid it because it can introduce difficult bugs.\n\nOutput control is another public area. In marimo, every cell can have a visual output, and the default output is the cell's last expression. The public runtime output API lets code replace, append, clear, or target output positions programmatically. The docs note a practical interaction between these mechanisms: a non-empty last expression replaces earlier output, so a developer who wants to add to existing output should append instead. Console text is treated separately from visual cell output; print statements and logs normally appear below a cell and do not show in app views unless public capture or redirect helpers are used to move stdout or stderr into cell output. The interface also includes a rich object inspection helper and a way to display cell code in app views."
}
