{
  "repo_id": "fogleman__Craft",
  "commit": "d6888a6e1e54340358ce25b1220f410541360b6b",
  "document_id": "world_generation_chunks_1",
  "topic": "World Generation and Chunks",
  "topic_slug": "world_generation_chunks",
  "difficulty": "easy",
  "generator": "codex_subagents_v1",
  "prompt_version": "design_doc_generation_v1",
  "description": "Explains how Craft generates deterministic terrain, stores block data by chunk, loads and updates chunks around the player, and builds renderable chunk buffers.",
  "document": "Craft treats world generation and chunk management as one pipeline: deterministic terrain is produced when a chunk is loaded, local edits are layered on top, and only nearby chunk buffers are kept ready for drawing. The README describes the world as split into square chunks in the horizontal XZ plane, with Y used as height. The default chunk width comes from `CHUNK_SIZE`, and the advanced settings in src/config.h use separate radii for creating, rendering, signs, and deletion. This lets the game behave like an infinite world without holding the whole world in memory.\n\nThe default terrain generator is `create_world` in src/world.c. It receives a chunk coordinate pair and calls a callback for every generated block, so the same generator can fill a client chunk map or be compiled into the Python server helper mentioned in the README. Its terrain height is based on Simplex noise at the global X and Z positions, making the same location generate the same terrain every time. Low areas are clamped to a flat water-level band and use sand, while higher ground uses grass. Optional feature switches in src/config.h control whether plants, trees, and clouds are added. Trees are deliberately skipped near chunk edges so their canopies do not spill unpredictably across chunk boundaries during base generation.\n\nChunk boundaries are handled by storing a one-block overlap around each chunk. The generator loops over a padded horizontal area and marks blocks outside the chunk's own square with negative block values. The README calls out this overlap as necessary for deciding which perimeter faces are exposed. The runtime uses the same idea when a player edits a boundary block: `set_block` writes the real block into its home chunk and writes negative overlap entries into neighboring chunk maps that also need to know about that block for rendering. Those negative entries describe neighboring solidity but are not treated as primary blocks when the chunk's own faces are counted.\n\nIn src/main.c, a `Chunk` owns maps for blocks and lights, sign data, render buffers, chunk coordinates, dirty state, and vertical bounds for culling. The map implementation in src/map.c is a small open-addressed hash table. Each map stores coordinates relative to an offset chosen when the chunk is initialized, so the chunk's interior plus its border can fit into compact byte-sized entries. When a chunk is loaded, the code first calls the terrain generator through a map-setting callback, then loads saved block and light changes from sqlite. That matches the README's database model: the database stores deltas, not a full copy of generated terrain.\n\nThe chunk lifecycle is centered on the player's current chunk. `ensure_chunks` first completes finished worker jobs, then forces the immediate surrounding chunks to exist synchronously so the player is not standing in missing terrain. Idle worker threads are assigned missing or dirty chunks within the creation radius. The assignment code prefers chunks that are visible, already have buffers needing refresh, and are closer to the player. Workers copy a three-by-three neighborhood of block and light maps before computing, which gives the mesh builder enough neighbor information for exposed faces, light spread, and ambient shading without reading live chunk maps from another thread.\n\nMesh generation happens in `compute_chunk`. It builds temporary opacity, light, and height arrays covering the target chunk plus neighbor margin, floods light from light-source maps when enabled, counts exposed faces only for the center chunk's positive blocks, then writes cube or plant geometry. `generate_chunk` uploads that computed data into OpenGL buffers and regenerates sign geometry. Rendering calls ensure chunk maintenance first, then draws only chunks inside the render radius and inside the camera frustum. Far chunks are later removed by the deletion pass, which frees their maps, signs, and buffers unless they are still close to the main or observed player views."
}
