{
  "repo_id": "psf__requests",
  "commit": "6ec76b4a36fba4a32fb72f5f9ba04e632635e477",
  "document_id": "auth_cookies_hooks_1",
  "topic": "Authentication, Cookies, and Hooks",
  "topic_slug": "auth_cookies_hooks",
  "difficulty": "easy",
  "generator": "codex_subagents_v1",
  "prompt_version": "design_doc_generation_v1",
  "description": "Explains how Requests applies authentication handlers, bridges cookies through CookieJar-compatible storage, and uses response hooks for user callbacks and digest-auth retry behavior.",
  "document": "Requests treats authentication, cookies, and hooks as small extension points that run while a request is being prepared or while a response is being handled. The authentication documentation presents Basic and Digest authentication as built-in forms, and it also explains the custom-auth contract: an authentication handler is any callable attached through the auth argument, and it gets a chance to modify the request before it is dispatched. In src/requests/auth.py, `AuthBase` captures that contract for implementations that subclass it, while tuple credentials are converted into Basic authentication during preparation.\n\nBasic authentication is intentionally direct. `HTTPBasicAuth` stores a username and password, then adds an Authorization header when called. The helper that builds the header preserves compatibility with non-string credentials by converting them with deprecation warnings, encodes text credentials as latin-1, and returns a native string. The proxy variant reuses the same credential formatting but writes the proxy authorization header instead. The tests confirm that tuple credentials prepare to the same header builder, byte-string credentials are encoded as bytes rather than their Python representation, and session-level authentication can supply credentials when the individual request does not.\n\nDigest authentication is more involved because the first response may be a challenge rather than the final answer. `HTTPDigestAuth` keeps per-thread challenge state, records the current body position if possible, and registers response hooks for challenge handling and redirect handling. When a 4xx response contains a digest challenge and the retry limit has not been hit, the handler parses the challenge, consumes and closes the original response, copies the prepared request, extracts any cookies from the failed response into the retry request, prepares those cookies, builds a new Authorization header, and resends through the same connection. The tests exercise successful digest requests, wrong-password failures, cookie preservation from digest responses, streaming behavior, and quoting of the digest quality-of-protection value.\n\nCookies are centered in src/requests/cookies.py, whose purpose is compatibility between Requests objects and Python's cookiejar machinery. The mock request and response wrappers expose just enough request URL, host, headers, and response header information for cookiejar policy checks and extraction. `extract_cookies_to_jar` reads Set-Cookie data from the original HTTP response when available, while `get_cookie_header` asks the jar which Cookie header should be attached to an outgoing request. This lets Requests use normal CookieJar policy without making the rest of the request model look like urllib's request objects.\n\nThe default cookie container, `RequestsCookieJar`, is still a CookieJar but adds a dictionary-like interface for caller convenience. Its mapping operations are linear scans rather than hash-table lookups because the underlying storage remains cookiejar storage. A named lookup can require domain or path to avoid ambiguity; if more than one cookie matches the same criteria, the jar raises a conflict instead of silently pretending there is only one value. Helper functions create cookies from dictionaries or morsels, merge dictionaries or jars into an existing jar, copy jars while preserving policy, and remove cookies by name. Tests show that sessions persist server cookies across calls, per-request cookies override session cookies without mutating the session jar, generic CookieJar instances continue working, duplicate names can require explicit domain or path selection, and expired cookies are removed.\n\nHooks provide the response-side extension point. In src/requests/hooks.py, `default_hooks` creates a response hook list, and `dispatch_hook` looks up hooks for an event, normalizes a single callable into a one-item list, and calls hooks in order. A hook receives the current data plus keyword arguments. If it returns a non-None value, that value becomes the data passed forward; if it returns None, the existing data remains. The advanced guide documents per-request hooks, session hooks that apply to every request on that session, ordered multiple hooks, and the rule that hook exceptions must be handled by the caller. The tests confirm both the replacement behavior and the default shape of the hook dictionary."
}
